title,content,date
Introducing Pledge Over Time — Now Available to all Creators,"Earlier this month, we introduced a suite of new features designed to improve the crowdfunding experience for both creators and backers. ICYMI, here’s aquick recap of what’s new. quick recap of what’s new Today, we’re unveiling another major improvement:Pledge Over Time, a smarter way to support ambitious projects on Kickstarter. Pledge Over Time Pledge Over Time allows backers to split their pledge into three equal, interest-free monthly payments. That means premium rewards become more accessible, and creators can hit bigger funding goals without changing how they build. Learn More Learn More Why We Built Pledge Over Time The most ambitious ideas deserve to be seen. But as projects evolve from epic board games to cutting-edge hardware so do their funding goals. Higher-tier rewards often require a larger upfront investment, making them harder for backers to commit to in one go. We heard this challenge loud and clear. Some backers held off on pledging altogether. Others paused at checkout, not because they were bored, but because the cost felt out of reach in a single payment. Pledge Over Time is our answer. It removes one of the most significant barriers in crowdfunding, the upfront cost, without adding complexity for creators or requiring interest-bearing loans for backers. Here’s how it works: For Backers: The first payment is charged when a project successfully funds. The remaining two payments are collected automatically each month.For Creators: After the campaign ends, you receive your standard payout and a payout of the first set of Pledge Over Time payments. Once the remaining Pledge Over Time payments are all collected, you will receive a final payout For Backers: The first payment is charged when a project successfully funds. The remaining two payments are collected automatically each month. For Creators: After the campaign ends, you receive your standard payout and a payout of the first set of Pledge Over Time payments. Once the remaining Pledge Over Time payments are all collected, you will receive a final payout Preview of ""Pledge Over Time"" on the pledge payment page What Creators Are Saying Before rolling it out, we pilotedPledge Over Timewith a select group of beta testers across multiple categories. The feedback? Immediate and enthusiastic. Pledge Over Time “First of all, thank you so much for making PLOT available to Kickstarter backers and to my campaign. We’ve received a good number of pledges we would not have otherwise received because of your new payment option.” —Rachel Rener(3X Publishing Creator) Rachel Rener “I would appreciate using it again. It gives more flexibility and can improve the campaign performance, especially for the ones with high reward tiers.” —Damian Korus(Games Designer of Exploration by Ply) Damian Korus When backers are given more flexibility in how they pledge, especially in ways that fit their lifestyle, they tend to aim higher. During our closed beta, campaigns that offered this payment feature saw average pledge amounts that were 42% higher, and backers who used Pledge Over Time pledged more than double the amount of those who paid upfront. For creators launching ambitious projects, it’s a simple shift that can lead to big results and make it easier for more backers to take part in bringing those ideas to life. Ready to Reach Higher? Pledge Over Time is live now and built to help you unlock more funds, make premium rewards more accessible, and reduce the friction at checkout. If you’re ready to give backers more ways to say yes, we’d love to see what you’ll build. Learn more about Pledge Over Time Learn more about Pledge Over Time",28 May 2025
How to Get Featured on Kickstarter in 2025,"Let’s cut to the chase… If you’ve ever asked, “How do I get my project featured on Kickstarter?” — you’re not alone. Every day, creators like you dream big, building bold, and hoping to land a covetedProjects We Lovebadge or a spot on our homepage or newsletter or even across our 3 million social media followers. Here’s the good news: there’s no secret handshake, special door knock, or secret password to whisper. We’re constantly on the lookout for exceptional projects to spotlight — and there’s a lot you can do to catch our eye. Below, we’ll break down exactly what makes a project feature-worthy in 2025 — from the way you tell your story to how you show up visually. Let’s dive in. What Does It Mean to Be Featured on Kickstarter? Getting featured can look like: Receiving a Projects We Love badge on your campaign pageBeing showcased on our homepageGetting a shoutout in a Kickstarter newsletterAppearing in editorial roundups or creator highlightsA shoutout from @Kickstarter on social Receiving a Projects We Love badge on your campaign page Being showcased on our homepage Getting a shoutout in a Kickstarter newsletter Appearing in editorial roundups or creator highlights A shoutout from @Kickstarter on social We don’t charge creators for these placements and they aren’t guaranteed boosts. Instead, they’re ways we highlight creativity, innovation, and standout storytelling across the platform. Our team hand-picks projects that inspire us — and we want to be inspired by yours. 10 Ways to Make Your Project Feature-Worthy in 2025 1. It Starts With the Pre-Launch Page Your journey to being featured doesn’t begin on launch day — it starts with your pre-launch page. Use compelling visuals, clear copy, and a captivating title to make visitors hit that “Notify me on launch” button.A high number of pre-launch watchers shows momentum — and catches our team’s attention before your campaign even goes live.Share your pre-launch page across socials, email lists, and communities where your audience already exists. Warm traffic leads to hot launches. Use compelling visuals, clear copy, and a captivating title to make visitors hit that “Notify me on launch” button. A high number of pre-launch watchers shows momentum — and catches our team’s attention before your campaign even goes live. Share your pre-launch page across socials, email lists, and communities where your audience already exists. Warm traffic leads to hot launches. Introducing the Pre-Launch Editor: A New Feature for StorytellingDiscover the latest Pre-Launch page features to maximize your Kickstarter campaign.Kickstarter Blog: Crowdfunding Tips, Stories & InsightsEllie Clinton Introducing the Pre-Launch Editor: A New Feature for StorytellingDiscover the latest Pre-Launch page features to maximize your Kickstarter campaign.Kickstarter Blog: Crowdfunding Tips, Stories & InsightsEllie Clinton Introducing the Pre-Launch Editor: A New Feature for Storytelling Discover the latest Pre-Launch page features to maximize your Kickstarter campaign. Kickstarter Blog: Crowdfunding Tips, Stories & InsightsEllie Clinton Kickstarter Blog: Crowdfunding Tips, Stories & Insights Ellie Clinton 2. Nothing Beats a Good Idea No gimmicks, no hype — just a clear, compelling idea. Whether you’re launching a short film, tabletop game, cookbook, or wearable tech, your project should communicate what you’re making and why it matters. Use a title and description that are straightforward and descriptiveAvoid ALL CAPS or exaggerated claimsProofread for grammar and typos (yes, it matters) Use a title and description that are straightforward and descriptive Avoid ALL CAPS or exaggerated claims Proofread for grammar and typos (yes, it matters) 📌Pro tip: Keep your project’s first two paragraphs skimmable. They should tell a new visitor exactly what they need to know in seconds. 📌 Pro tip: Keep your project’s first two paragraphs skimmable. They should tell a new visitor exactly what they need to know in seconds. 3. Choose a Compelling Project Image This is your project’s visual handshake — the first thing people see. Use a bright, high-resolution image that clearly showcases your productAvoid overlays, cluttered designs, or anything that obscures the subjectThink social-first: what image would make someone stop scrolling? Use a bright, high-resolution image that clearly showcases your product Avoid overlays, cluttered designs, or anything that obscures the subject Think social-first: what image would make someone stop scrolling? Your image should immediately answer: What is this? Why should I care? How to Use Images to Effectively Communicate Your Project’s RewardsClear, simple images are key to running a successful campaign. Here are some tips for creating images that effectively convey to backers what your rewards are.Kickstarter Blog: Crowdfunding Tips, Stories & InsightsGeorge Rohac How to Use Images to Effectively Communicate Your Project’s RewardsClear, simple images are key to running a successful campaign. Here are some tips for creating images that effectively convey to backers what your rewards are.Kickstarter Blog: Crowdfunding Tips, Stories & InsightsGeorge Rohac How to Use Images to Effectively Communicate Your Project’s Rewards Clear, simple images are key to running a successful campaign. Here are some tips for creating images that effectively convey to backers what your rewards are. Kickstarter Blog: Crowdfunding Tips, Stories & InsightsGeorge Rohac Kickstarter Blog: Crowdfunding Tips, Stories & Insights George Rohac 4. Lead With the Essentials People skim — so structure your page accordingly. Frontload your page with the who, what, and whySave the origin story and deep-dive content for later down the pageUse headers and bold text to make information easy to digest Frontload your page with the who, what, and why Save the origin story and deep-dive content for later down the page Use headers and bold text to make information easy to digest Remember: your goal is to spark interest and build trust from the jump. 5 Ways to Maximize Kickstarter Pre-Launch Sign-UpsUnlock the potential of your Kickstarter campaign by mastering these essential strategies for a successful pre-launch sign-up phase.Kickstarter Blog: Crowdfunding Tips, Stories & InsightsBrandon Smithwrick 5 Ways to Maximize Kickstarter Pre-Launch Sign-UpsUnlock the potential of your Kickstarter campaign by mastering these essential strategies for a successful pre-launch sign-up phase.Kickstarter Blog: Crowdfunding Tips, Stories & InsightsBrandon Smithwrick 5 Ways to Maximize Kickstarter Pre-Launch Sign-Ups Unlock the potential of your Kickstarter campaign by mastering these essential strategies for a successful pre-launch sign-up phase. Kickstarter Blog: Crowdfunding Tips, Stories & InsightsBrandon Smithwrick Kickstarter Blog: Crowdfunding Tips, Stories & Insights Brandon Smithwrick 5. Show, Don’t Just Tell Visual storytelling is a game-changer. Don’t just write about what you’re making — show it. Include high-quality photos, videos, and GIFsAdd behind-the-scenes shots of your creative process. If you’re a musician, share audio tracks; if you’re a designer, show prototypes Include high-quality photos, videos, and GIFs Add behind-the-scenes shots of your creative process. If you’re a musician, share audio tracks; if you’re a designer, show prototypes Let your page feel like a vibrant window into your world — not just a wall of text. 6. Highlight Rewards With Visuals Backers want to know what they’re getting. Make it crystal clear. Show images of physical products or prototypesInclude descriptions that are concise and benefits-focusedIf relevant, show past successful projects or similar rewards Show images of physical products or prototypes Include descriptions that are concise and benefits-focused If relevant, show past successful projects or similar rewards Help people picture the moment they open your reward — what do they see? What do they feel? Images on Rewards Is Now Live!This update enables creators to feature an image of each of their project’s rewards in the respective reward tier section of their project page.Kickstarter Blog: Crowdfunding Tips, Stories & InsightsEllie Clinton Images on Rewards Is Now Live!This update enables creators to feature an image of each of their project’s rewards in the respective reward tier section of their project page.Kickstarter Blog: Crowdfunding Tips, Stories & InsightsEllie Clinton Images on Rewards Is Now Live! This update enables creators to feature an image of each of their project’s rewards in the respective reward tier section of their project page. Kickstarter Blog: Crowdfunding Tips, Stories & InsightsEllie Clinton Kickstarter Blog: Crowdfunding Tips, Stories & Insights Ellie Clinton 7. Tag Us to Get Noticed Your campaign doesn’t exist in a vacuum — and neither do we. Mentioning @Kickstarter puts your project on our radar. Our handle is tagged & mentioned over 60,000 times each month, so if you’re creating buzz, we’re likely watching.Create a moment — not just a post. Share your journey with behind-the-scenes videos, bold visuals, and personal stories. The more shareable and compelling your content, the more likely it is to get noticed by both our team and the broader community. Mentioning @Kickstarter puts your project on our radar. Our handle is tagged & mentioned over 60,000 times each month, so if you’re creating buzz, we’re likely watching. Create a moment — not just a post. Share your journey with behind-the-scenes videos, bold visuals, and personal stories. The more shareable and compelling your content, the more likely it is to get noticed by both our team and the broader community. A Guide to a Successful Social Media Marketing CampaignStep into the world of viral content and engage audiences with our comprehensive strategy for social media marketing success.Kickstarter Blog: Crowdfunding Tips, Stories & InsightsBrandon Smithwrick A Guide to a Successful Social Media Marketing CampaignStep into the world of viral content and engage audiences with our comprehensive strategy for social media marketing success.Kickstarter Blog: Crowdfunding Tips, Stories & InsightsBrandon Smithwrick A Guide to a Successful Social Media Marketing Campaign Step into the world of viral content and engage audiences with our comprehensive strategy for social media marketing success. Kickstarter Blog: Crowdfunding Tips, Stories & InsightsBrandon Smithwrick Kickstarter Blog: Crowdfunding Tips, Stories & Insights Brandon Smithwrick 8. Right Category. Right Time. Choosing the right lane sets you up for the proper spotlight. Our team curates category-specific newsletters — so your project has a better chance of being featured if it’s properly tagged.Launching your project during one of our themed Open Calls (like Make 100 or Zine Quest) can lead to increased visibility and promotion across our platform.Plan your calendar accordingly. Check Kickstarter’s seasonal initiatives and align your project with key cultural or category-specific moments. Our team curates category-specific newsletters — so your project has a better chance of being featured if it’s properly tagged. Launching your project during one of our themed Open Calls (like Make 100 or Zine Quest) can lead to increased visibility and promotion across our platform. Plan your calendar accordingly. Check Kickstarter’s seasonal initiatives and align your project with key cultural or category-specific moments. The Benefit of Launching an Open Call CampaignLearn how Kickstarter’s Open Calls boost visibility, build connections, and bring your creative vision to life.Kickstarter Blog: Crowdfunding Tips, Stories & InsightsBrandon Smithwrick The Benefit of Launching an Open Call CampaignLearn how Kickstarter’s Open Calls boost visibility, build connections, and bring your creative vision to life.Kickstarter Blog: Crowdfunding Tips, Stories & InsightsBrandon Smithwrick The Benefit of Launching an Open Call Campaign Learn how Kickstarter’s Open Calls boost visibility, build connections, and bring your creative vision to life. Kickstarter Blog: Crowdfunding Tips, Stories & InsightsBrandon Smithwrick Kickstarter Blog: Crowdfunding Tips, Stories & Insights Brandon Smithwrick 9. Keep It Inclusive and Accessible Kickstarter is a global, all-ages platform — your project should reflect that. Avoid explicit content or strong profanityAdd subtitles and captions to videosUse alt text for imagesIf your project uses another language, include English translations when possible Avoid explicit content or strong profanity Add subtitles and captions to videos Use alt text for imagesIf your project uses another language, include English translations when possible Making your project more accessible doesn’t just widen your audience — it shows respect for the diverse community backing creative work on Kickstarter. 10. Don’t Spam Seriously. Don’t do it. Don’t send mass DMsDon’t post links in unrelated comment sectionsDon’t hijack threads or communities you’re not part of Don’t send mass DMs Don’t post links in unrelated comment sections Don’t hijack threads or communities you’re not part of Play by the rules. Building buzz should come from connection, not coercion. Need some inspiration? Check out these project pages DABEI Travelpods DABEI Travelpods The Misen Carbon Nonstick Pan The Misen Carbon Nonstick Pan A Trial of Lace and Bone - Deluxe Black Page Special Edition A Trial of Lace and Bone - Deluxe Black Page Special Edition FINO V | Revolutionize Your Urban Carry FINO V | Revolutionize Your Urban Carry The Bed Sheet | Revived The Bed Sheet | Revived Animation VERSUS Animation VERSUS The Cloaked Realm Animated Series: Season One The Cloaked Realm Animated Series: Season One Kickstarter Is a Stage — Make It Count There are thousands of projects that are live at any given moment so we can’t feature them all — but we can spotlight the ones that rise above the noise. So, whether you’re preparing to launch or looking to optimize mid-campaign, use these tips to build a standout presence. Unlock your funding potentialJoin the thousands of visionary creators choosing to put their ideas into action on Kickstarter. Start your free project draft today and explore all the tools you need to turn your vision into reality.Get Started Unlock your funding potentialJoin the thousands of visionary creators choosing to put their ideas into action on Kickstarter. Start your free project draft today and explore all the tools you need to turn your vision into reality.Get Started Unlock your funding potentialJoin the thousands of visionary creators choosing to put their ideas into action on Kickstarter. Start your free project draft today and explore all the tools you need to turn your vision into reality.Get Started Unlock your funding potential Unlock your funding potential Join the thousands of visionary creators choosing to put their ideas into action on Kickstarter. Start your free project draft today and explore all the tools you need to turn your vision into reality. Join the thousands of visionary creators choosing to put their ideas into action on Kickstarter. Start your free project draft today and explore all the tools you need to turn your vision into reality. Get Started",21 Apr 2025
