title,content,date
Navigating Tariffs and Shipping Costs: Tips for Kickstarter Creators,"Kickstarter Is Here for You. Our team chats with creators daily, and we know many of you are feeling the pressure right now. Whether you’re just starting to plan your next campaign or you’re in the middle of production. Recent changes to U.S. tariffs on imported goods are driving up production costs. If you’re a creator who depends on overseas manufacturing, small-batch production, or even prototyping internationally, this is more than just a headline. It’s a very real challenge to your timeline, your budget, and your ability to deliver on your creative vision. At Kickstarter, we see you. And we’re here to help you navigate this moment. This blog is the first step in an ongoing effort to provide creators with real-time resources, tips, and tools to overcome challenges and continue creating in a changing landscape. Guidance on accounting for unpredictable costs: 1. Strategies to Mitigate Tariff Challenges As tariffs and production costs shift, there are various ways to incorporate these changes into your reward and/or shipping pricing. Here are some practical steps you can take to navigate these changes: Reward Tier Pricing If you’re in the pre-launch phase of your campaign, either in project build or have yet to hit that launch button, you can account for these changes by adjusting your reward pricing during campaign setup. To accurately recalculate costs for each tier, consider using tools likeUPS TradeAbilityto assess shipping complexities. Additionally, you can estimate tariff impacts by applying percentage increases based on resources such as theConference Board Tariff Tracker. By factoring in these estimates, you can set informed pricing for your rewards and ensure a successful campaign launch. UPS TradeAbility Conference Board Tariff Tracker Here is some additional guidanceon structuring your rewards by price. As always, be transparent with backers about why adjustments are necessary—communications and trust build community. Here is some additional guidance If you currently have a live campaign, while rewards that backers have pledged to cannot have their price adjusted, you can look to balance costs by altering shipping costs. The Psychology of Pricing Kickstarter RewardsExplore the psychological strategies behind reward pricing to attract more backers and optimize your Kickstarter campaign’s success.Kickstarter Blog: Crowdfunding Tips, Stories & InsightsBrandon Smithwrick The Psychology of Pricing Kickstarter RewardsExplore the psychological strategies behind reward pricing to attract more backers and optimize your Kickstarter campaign’s success.Kickstarter Blog: Crowdfunding Tips, Stories & InsightsBrandon Smithwrick The Psychology of Pricing Kickstarter Rewards Explore the psychological strategies behind reward pricing to attract more backers and optimize your Kickstarter campaign’s success. Kickstarter Blog: Crowdfunding Tips, Stories & InsightsBrandon Smithwrick Kickstarter Blog: Crowdfunding Tips, Stories & Insights Brandon Smithwrick Shipping Pricing Our new Pledge Manager(currently in beta)allows you to set up shipping post-campaign, closer to the fulfillment phase of your campaign —when you have a clearer picture of your actual costs. You can account for any increased costs at that time. If you have a live or recently successful campaign and have not charged shipping for pledges yet, you can reach out topledgemanagement@kickstarter.comand our post-campaign team can help set you up. In Pledge Manager, you’ll also be able to: Set Shipping Post-Campaign:Determine rates closer to fulfillment when actual costs are clearer.Country-Specific Rates:Tailor shipping fees by region.Add New Countries:Add specific shipping rates based on where your backers are. Set Shipping Post-Campaign:Determine rates closer to fulfillment when actual costs are clearer. Country-Specific Rates:Tailor shipping fees by region. Add New Countries:Add specific shipping rates based on where your backers are. Using tools like Pledge Manager allows you to account for increased costs without overestimating or undercharging during your campaign phase.Reach out to usto assess fit for your current or future campaign. Reach out to us Kickstarter’s 2025 Product RoadmapDiscover how we’re giving creators an all-in-one crowdfunding experience, enhancing the backer experience and building trust in our communityKickstarter Blog: Crowdfunding Tips, Stories & InsightsKickstarter Staff Kickstarter’s 2025 Product RoadmapDiscover how we’re giving creators an all-in-one crowdfunding experience, enhancing the backer experience and building trust in our communityKickstarter Blog: Crowdfunding Tips, Stories & InsightsKickstarter Staff Kickstarter’s 2025 Product Roadmap Discover how we’re giving creators an all-in-one crowdfunding experience, enhancing the backer experience and building trust in our community Kickstarter Blog: Crowdfunding Tips, Stories & InsightsKickstarter Staff Kickstarter Blog: Crowdfunding Tips, Stories & Insights Kickstarter Staff 2. Estimated shipping costs by region To help you plan ahead, here’s a breakdown of estimated shipping cost increases based on common ship-from/to scenarios. These figures are broad estimates and may fluctuate as global trade conditions evolve. We strongly encourage creators to verify and update shipping costs regularly, especially before finalizing rates in Pledge Manager, to ensure accuracy and avoid unexpected expenses. As of April 4th, 2025 @ 1:00PM EDT.Find the full up-to-date details here. Find the full up-to-date details here US Tariff by Country or Sector US Tariff by Country or Sector Latest Rate of US Tariff Latest Rate of US Tariff European Union, includes: European Union, includes: Germany, Ireland, Italy, France, Netherlands, Belgium Germany, Ireland, Italy, France, Netherlands, Belgium 10% in effect April 520% in effect April 9 10% in effect April 5 20% in effect April 9 Mexico Mexico 25% in effect for goods not covered by USMCA 25% in effect for goods not covered by USMCA China China 54% total in effect on April 9 54% total in effect on April 9 20% in effect as of March 4, an additional 34% was announced on April 2, for a total of 54% 20% in effect as of March 4, an additional 34% was announced on April 2, for a total of 54% Canada Canada 25% in effect for goods not covered by USMCA 25% in effect for goods not covered by USMCA 10% in effect for energy and energy resources 10% in effect for energy and energy resources 10% in effect for potash (fertilizer) 10% in effect for potash (fertilizer) Japan Japan 10% effective April 5 10% effective April 5 24% effective April 9 24% effective April 9 India India 10% effective April 5 10% effective April 5 26% effective April 9 26% effective April 9 United Kingdom United Kingdom 10% effective April 5 and continues at that rate 10% effective April 5 and continues at that rate For the most up to date news and data — See more here For the most up to date news and data — See more here For some creators, leveraging domestic manufacturing may be another option. While potentially more expensive upfront, domestic production can mitigate uncertainty and improve delivery timelines. Cost-Effective International Shipping: Crowdfunding GuideDiscover how Easyship helps Creators find low-cost international shipping options, streamline global deliveries, and save up to 91% on shipping costs with expert tools and support.Kickstarter Blog: Crowdfunding Tips, Stories & InsightsEasyship Cost-Effective International Shipping: Crowdfunding GuideDiscover how Easyship helps Creators find low-cost international shipping options, streamline global deliveries, and save up to 91% on shipping costs with expert tools and support.Kickstarter Blog: Crowdfunding Tips, Stories & InsightsEasyship Cost-Effective International Shipping: Crowdfunding Guide Discover how Easyship helps Creators find low-cost international shipping options, streamline global deliveries, and save up to 91% on shipping costs with expert tools and support. Kickstarter Blog: Crowdfunding Tips, Stories & InsightsEasyship Kickstarter Blog: Crowdfunding Tips, Stories & Insights Easyship 3. Resources for Creators Kickstarter’s Creator Resource Hub is packed with guidance designed to help you navigate these challenges: International Shipping Tips: Learn how to streamline logistics and cut costs.Manufacturing Guides: Get insights into sourcing materials and managing production timelines.Case Studies: See how other creators have overcome similar challenges.Free Video Courses: Plan ahead with expert advice tailored for Kickstarter campaigns. International Shipping Tips: Learn how to streamline logistics and cut costs. International Shipping Tips Manufacturing Guides: Get insights into sourcing materials and managing production timelines. Manufacturing Guides Case Studies: See how other creators have overcome similar challenges. Case Studies Free Video Courses: Plan ahead with expert advice tailored for Kickstarter campaigns. Free Video Courses As always, our team remains committed to developing new resources and tools to support your success at every stage of your creative journey. This policy change won’t alter our dedication to helping you navigate challenges and achieve your goals. Introducing Learning Lab: A Free Crowdfunding Course in Partnership with LaunchBoomA new online video curriculum designed to make crowdfunding more accessible and help creators launch successful campaigns with expert-backed insights.Kickstarter Blog: Crowdfunding Tips, Stories & InsightsKickstarter Staff Introducing Learning Lab: A Free Crowdfunding Course in Partnership with LaunchBoomA new online video curriculum designed to make crowdfunding more accessible and help creators launch successful campaigns with expert-backed insights.Kickstarter Blog: Crowdfunding Tips, Stories & InsightsKickstarter Staff Introducing Learning Lab: A Free Crowdfunding Course in Partnership with LaunchBoom A new online video curriculum designed to make crowdfunding more accessible and help creators launch successful campaigns with expert-backed insights. Kickstarter Blog: Crowdfunding Tips, Stories & InsightsKickstarter Staff Kickstarter Blog: Crowdfunding Tips, Stories & Insights Kickstarter Staff 4. A Team That Believes in Your Work Challenging moments like this remind us why Kickstarter exists in the first place—to give creators ownership of their ideas and to build communities that believe in them. If you’re planning a campaign, adjusting your costs, or just trying to figure out the next steps, Kickstarter is here for you—with tools, people, and a platform that believes in your work. We want to hear from you!Please contact usfor 24 hour campaign support. Please contact us Let’s keep building together. Have a question? Ask it here Have a question? Ask it here —Your friends at Kickstarter",04 Apr 2025
Introducing Learning Lab: A Free Crowdfunding Course in Partnership with LaunchBoom,"Hey there, future creators, entrepreneurs, and visionaries! Every great business, product, and crowdfunding campaign begins with an idea. However, turning that idea into reality requires strategy, planning, and the right resources. Let’s be honest—while ideas are common, the bravery to pursue them is truly extraordinary. So, buckle up! We has some exciting news that will make your creative journey smoother now and for years to come. We’re thrilled to introduce ✨Learning Lab✨, our new online video curriculum developed in partnership with the crowdfunding experts atLaunchBoom. And the best part?It’s absolutely free! Learning Lab LaunchBoom Start Learning Start Learning If you’ve ever wondered how to effectively launch on Kickstarter, set realistic goals, or attract and engage backers, you’re in the right place. Whether you’re a first-time creator or looking to elevate your crowdfunding game, this invaluable resource is designed to guide you through every stage of your campaign journey. Preview of ""Crowdfunding Timeline and Strategy"" taught by Nick Yulman What's Learning Lab? At Kickstarter, we believe that crowdfunding should be accessible to all creators. That’s why we builtLearning Lab—to break down the crowdfunding process into digestible, expert-led lessons that equip you with the knowledge you need to succeed. The Goal of Learning Lab: Make crowdfunding more accessiblewith a free, low-barrier educational tool.Empower creatorswith best practices that lead to long-term success.Gain valuable insightswith LaunchBoom’s expertise, which are systematic and lead to real results. By combining our platform knowledge with innovative marketing tactics, this course will provide everything you need to understand how to launch a campaign. Make crowdfunding more accessiblewith a free, low-barrier educational tool. Empower creatorswith best practices that lead to long-term success. Gain valuable insightswith LaunchBoom’s expertise, which are systematic and lead to real results. By combining our platform knowledge with innovative marketing tactics, this course will provide everything you need to understand how to launch a campaign. Preview of ""Pre-Launch Overview"" taught by , CEO and co-founder of LaunchBoom What You’ll Learn The curriculum is structured intotwo learning tracks:The Basics of Crowdfunding, presented by Kickstarter, andLaunch Strategy & Production Essentials, led by Launchboom. Covering every stage of crowdfunding—from ideation to post-launch success—each module includes expert-led video lessons designed to equip you with the knowledge and tools to confidently set up, launch, and manage your campaign. Start the Course Start the Course",25 Feb 2025
12 Things You Must Do Before Launching on Kickstarter,"You're ready to share your idea with the world—we understand! But before you run to hit that big green launch button, let’s make sure everything is set up for success. Better to be safe than sorry so this checklist is here to help you tick all the right boxes—from making sure your bank details are in order to double-checking your campaign messaging—so you can launch with confidence and give your project the best shot at funding success. If you found this article helpful but want even more guidance, check outLearning Lab—our step-by-step video series where our campaign strategy team walks you through every phase of the crowdfunding process. Learning Lab Enough talking; it's time to dive into these 12 steps. 1. Set Up Your Kickstarter Account Details First things first—before you do anything else, make sure your Kickstarter account is set up correctly. Bank account info: Get this verified early to avoid any payout hiccups later.Identity verification: Kickstarter needs to confirm who you are before you can launch. Do this ahead of time to prevent delays. Bank account info: Get this verified early to avoid any payout hiccups later. Bank account info Identity verification: Kickstarter needs to confirm who you are before you can launch. Do this ahead of time to prevent delays. 2. Make Sure Your Project Video is On Point Your video is basically your project’s first impression—so make it count! Upload it earlyto check for any weird formatting issues.Keep itengaging, clear, and under 2 minutes—short and sweet wins here.Watch it ondesktop and mobileto make sure it looks solid everywhere. Upload it earlyto check for any weird formatting issues. Keep itengaging, clear, and under 2 minutes—short and sweet wins here. Watch it ondesktop and mobileto make sure it looks solid everywhere. How To Make an Awesome VideoIf you’re like us, the first thing you do when visiting a project page is click play. A video is by far the best way to get a feel for the emotions, motivations, and character of a project. It’s a demonstration of effort and a good predictor ofKickstarter Blog: Crowdfunding Tips, Stories & InsightsKickstarter Staff How To Make an Awesome VideoIf you’re like us, the first thing you do when visiting a project page is click play. A video is by far the best way to get a feel for the emotions, motivations, and character of a project. It’s a demonstration of effort and a good predictor ofKickstarter Blog: Crowdfunding Tips, Stories & InsightsKickstarter Staff How To Make an Awesome Video If you’re like us, the first thing you do when visiting a project page is click play. A video is by far the best way to get a feel for the emotions, motivations, and character of a project. It’s a demonstration of effort and a good predictor of Kickstarter Blog: Crowdfunding Tips, Stories & InsightsKickstarter Staff Kickstarter Blog: Crowdfunding Tips, Stories & Insights Kickstarter Staff 3. Plan Your Launch Strategy Like a Pro A little planning goes a long way. Before you go live, think about: The best time to launch: Mid-week is usually better than weekends.Your initial outreach plan: Who are you telling first? Friends? Family? Your social media crew?Who’s doing what: If you’ve got a team, assign roles so everyone’s clear on their tasks. The best time to launch: Mid-week is usually better than weekends. Your initial outreach plan: Who are you telling first? Friends? Family? Your social media crew? Who’s doing what: If you’ve got a team, assign roles so everyone’s clear on their tasks. 4. Double-Check Your Campaign End Date & Time By default, Kickstarter sets your campaign end time to match your launch time. But if you want it to end at a different time of day: Click“End on date and time”under Funding Duration.Manually adjust theTime boxto your preferred time. Click“End on date and time”under Funding Duration. Manually adjust theTime boxto your preferred time. 5. Make Your Title & Blurb Search-Friendly Yourtitle and blurbare like your campaign’s elevator pitch. They also help people find your project, so: Usekeywordspeople might search for.Keep itclear, catchy, and no weird symbols.Make itshort but compelling—grab attention fast! Usekeywordspeople might search for. Keep itclear, catchy, and no weird symbols. Make itshort but compelling—grab attention fast! 6. Check (and Double-Check) Your Funding Goal Once you hit launch, your funding goal is locked in—so get it right the first time! Make sure your goalcovers everything—production, shipping, Kickstarter fees, and a little buffer.Check out similar projects toset a realistic goal. Make sure your goalcovers everything—production, shipping, Kickstarter fees, and a little buffer. Check out similar projects toset a realistic goal. 7. Proofread Your Copy & Reward Tiers Nothing kills credibility faster than typos or broken links. Before launching: Read through your project page carefully(or ask a friend to do it).Double-checkreward tiers—once someone pledges, you can’t change them.Clickevery linkto make sure they actually work. Read through your project page carefully(or ask a friend to do it). Double-checkreward tiers—once someone pledges, you can’t change them. Clickevery linkto make sure they actually work. 8. Get a Second Opinion with a Preview A fresh set of eyes can catch things you might’ve missed. Before going live: Share thepreview linkwith a few trusted people.Ask for feedback on clarity, pricing, and messaging.Make anylast-minute tweaksbefore launch day. Share thepreview linkwith a few trusted people. Ask for feedback on clarity, pricing, and messaging. Make anylast-minute tweaksbefore launch day. 9. Figure Out Shipping & Fulfillment Shipping is one of the trickiest parts of crowdfunding, so don’t leave it to the last minute: Clearly setdomestic vs. international shipping options.Include domestic shipping in reward pricesto keep it simple.Researchshipping costsahead of time so you don’t undercharge. Clearly setdomestic vs. international shipping options. Include domestic shipping in reward pricesto keep it simple. Researchshipping costsahead of time so you don’t undercharge. Kickstarter Pledge Manager: Now Available to All CreatorsA streamlined way to manage post-campaign logistics and offer add-ons and upgrades, without ever leaving the Kickstarter platform.Kickstarter Blog: Crowdfunding Tips, Stories & InsightsMahesh Guruswamy Kickstarter Pledge Manager: Now Available to All CreatorsA streamlined way to manage post-campaign logistics and offer add-ons and upgrades, without ever leaving the Kickstarter platform.Kickstarter Blog: Crowdfunding Tips, Stories & InsightsMahesh Guruswamy Kickstarter Pledge Manager: Now Available to All Creators A streamlined way to manage post-campaign logistics and offer add-ons and upgrades, without ever leaving the Kickstarter platform. Kickstarter Blog: Crowdfunding Tips, Stories & InsightsMahesh Guruswamy Kickstarter Blog: Crowdfunding Tips, Stories & Insights Mahesh Guruswamy 10. Make Sure Your Project Image Pops Your project image is the first thing people see, so make sure it’s eye-catching: Check how it looks behind the play button.Use ahigh-quality, high-res image.Make sure it looks good indifferent sizes and formats. Check how it looks behind the play button. Use ahigh-quality, high-res image. Make sure it looks good indifferent sizes and formats. 11. Don’t Get Stuck in Kickstarter’s Review Queue Kickstarter reviews some projects before launch, so don’t wait until the last minute: Click“Continue” at least two business days before launching.If you get flagged for review, contact Kickstarter’s support.You can still tweak things while waiting for approval. Click“Continue” at least two business days before launching. If you get flagged for review, contact Kickstarter’s support. You can still tweak things while waiting for approval. 12. Have Your FAQs Ready to Go You can’t add FAQs until your project is live, but that doesn’t mean you can’t prep them ahead of time! Write answers forcommon questionsabout your project.Covershipping, timelines, and product details.Be ready toupdate FAQs as neededonce people start asking things. Write answers forcommon questionsabout your project. Covershipping, timelines, and product details. Be ready toupdate FAQs as neededonce people start asking things. Final Thoughts: Ready, Set, Launch! Launching a Kickstarter project is both exciting and nerve-wracking. But with this checklist, you’re covering all the important stuff so you can hit that green button with confidence. To help you further feel free to download this launch checklist so you can keep it handy before your next campaign. Once you’ve checked everything off, it’s time to go live and make it happen! Unlock your funding potentialJoin the thousands of visionary creators choosing to put their ideas into action on Kickstarter. Start your free project draft today and explore all the tools you need to turn your vision into reality.Get Started Unlock your funding potentialJoin the thousands of visionary creators choosing to put their ideas into action on Kickstarter. Start your free project draft today and explore all the tools you need to turn your vision into reality.Get Started Unlock your funding potentialJoin the thousands of visionary creators choosing to put their ideas into action on Kickstarter. Start your free project draft today and explore all the tools you need to turn your vision into reality.Get Started Unlock your funding potential Unlock your funding potential Join the thousands of visionary creators choosing to put their ideas into action on Kickstarter. Start your free project draft today and explore all the tools you need to turn your vision into reality. Join the thousands of visionary creators choosing to put their ideas into action on Kickstarter. Start your free project draft today and explore all the tools you need to turn your vision into reality. Get Started",13 Feb 2025
